course_id,title,description,price,duration_hours,tutor_introduction,,,
10001,Introduction to Python Programming,"Python is a versatile and beginner-friendly programming language widely used for web development, data analysis, artificial intelligence, and more. This course provides an introduction to Python programming, covering basic syntax, data types, control structures, functions, and object-oriented programming.",29.99,15,Dr. Michael Williams is an experienced Python developer and educator. He holds a Ph.D. in Computer Science from Harvard University and has taught Python programming courses at leading universities. Dr. Williams is passionate about making programming accessible to everyone and helping students become proficient Python programmers.,,,
10002,Introduction to Artificial Intelligence,"Artificial intelligence (AI) is the simulation of human intelligence processes by machines, especially computer systems. This course provides an introduction to AI concepts and techniques, including machine learning, neural networks, natural language processing, and robotics. Students will explore real-world applications of AI and learn how to develop AI-powered solutions.",69.99,30,Alexander Moore is a leading AI researcher with a Ph.D. in Computer Science from Stanford University. He has published groundbreaking research in the field and has contributed to the development of AI technologies. Alexander is dedicated to sharing his knowledge and inspiring the next generation of AI enthusiasts.,,,
10003,Mobile App Development Fundamentals,"Mobile app development is the process of creating software applications for mobile devices such as smartphones and tablets. This course covers the fundamentals of mobile app development, including app design, user interface development, programming languages, and app deployment. Students will learn how to build functional and user-friendly mobile apps.",79.99,35,Natalie Baker is a mobile app developer with a passion for creating innovative and user-friendly apps. She holds a Bachelor's degree in Computer Science from Stanford University and has developed mobile apps for both iOS and Android platforms. Natalie enjoys sharing her knowledge and helping students turn their app ideas into reality.,,,
10004,Data Science Fundamentals,"Data science is an interdisciplinary field that uses scientific methods, algorithms, processes, and systems to extract knowledge and insights from structured and unstructured data. This course covers the fundamental concepts of data science, including data analysis, machine learning, data visualization, and more. It provides hands-on experience with real-world datasets and practical examples to help students develop essential skills in data science.",99.99,40,Dr. Emily Johnson is a renowned data scientist with over a decade of experience in the field. She holds a Ph.D. in Computer Science from Stanford University and has published several research papers on machine learning and data mining. Dr. Johnson is passionate about teaching and is committed to helping students learn and succeed in the field of data science.,,,
10005,Introduction to Economics,"Economics is the study of how societies allocate scarce resources to satisfy unlimited wants and needs. This course provides an introduction to economic principles, including microeconomics, macroeconomics, supply and demand, market structures, and economic policy. Students will gain a deeper understanding of how economies work and the role of economics in decision-making.",69.99,30,David Thompson is an experienced economist with a Ph.D. in Economics from Yale University. He has conducted research on various economic issues and has taught economics courses at leading universities. David is dedicated to making economics accessible and engaging for students.9012345678,Public Speaking Mastery,"Public speaking is the process of communicating information to an audience effectively and persuasively. This course focuses on mastering the art of public speaking, including speech preparation, delivery techniques, body language, vocal variety, and handling nervousness. Students will learn how to engage and captivate an audience with confidence.","Liam Gonzalez is a seasoned public speaker and communication coach. He holds a Master's degree in Communication Studies from UCLA and has delivered speeches at conferences, seminars, and TEDx events. Liam is passionate about helping individuals overcome their fear of public speaking and become confident speakers."
10006,Financial Accounting Basics,"Financial accounting is the process of recording, summarizing, and reporting the financial transactions of a business. This course covers the basics of financial accounting, including the principles of accounting, balance sheets, income statements, cash flow statements, and more. Students will learn how to analyze financial statements and make informed business decisions.",59.99,35,Charlotte Wilson is a certified public accountant (CPA) with extensive experience in financial accounting. She holds a Master's degree in Accounting from NYU and has worked for both public accounting firms and private companies. Charlotte is passionate about teaching and enjoys helping students understand complex accounting concepts.,,,
10007,Creative Writing Workshop,"Creative writing is the art of crafting original works of literature, such as novels, short stories, poems, and plays. This course provides a comprehensive workshop experience in creative writing, covering various genres and techniques. Students will explore their creativity, develop their writing skills, and receive constructive feedback on their work.",59.99,25,Amelia Martin is an accomplished author and creative writing instructor. She holds a Master of Fine Arts (MFA) in Creative Writing from the Iowa Writers' Workshop and has published several novels and short stories. Amelia is passionate about helping aspiring writers find their voice and develop their craft.,,,
10008,Web Development Basics,"Web development is the process of building and maintaining websites and web applications. This course introduces the basics of web development, including HTML, CSS, JavaScript, and more. Students will learn how to create static and dynamic web pages, style them with CSS, and add interactivity with JavaScript.",49.99,20,John Smith is a seasoned web developer with extensive experience in front-end and back-end development. He holds a Bachelor's degree in Computer Science from MIT and has worked on various web projects for both small startups and large corporations. John is dedicated to helping students master the fundamentals of web development and achieve their goals in the industry.,,,
10009,Introduction to Psychology,"Psychology is the scientific study of behavior and mental processes. This course provides an introduction to psychology, including the history of psychology, research methods, biological psychology, cognitive psychology, developmental psychology, and social psychology. Students will gain insights into human behavior and the factors that influence it.",49.99,25,"Jack Moore is a licensed psychologist and psychology professor. He holds a Ph.D. in Psychology from Stanford University and has conducted research on topics such as cognitive development, social cognition, and emotional intelligence. Jack is passionate about teaching psychology and helping students understand the complexities of the human mind.",,,
10010,Introduction to Data Visualization,"Data visualization is the graphical representation of information and data to facilitate understanding and decision-making. This course introduces the principles and techniques of data visualization, including charts, graphs, maps, and dashboards. Students will learn how to create visually appealing and informative visualizations using popular data visualization tools and libraries.",39.99,20,James Miller is a seasoned data analyst and visualization expert. He holds a Master's degree in Data Science from Columbia University and has worked on various data visualization projects for companies in different industries. James is committed to helping students master the art of data visualization and effectively communicate insights from data.,,,
10011,Photography Masterclass,"Photography is the art, application, and practice of creating durable images by recording light or other electromagnetic radiation. This course offers a comprehensive masterclass in photography, covering advanced techniques in composition, lighting, exposure, and post-processing. Students will learn how to capture breathtaking photographs and refine their artistic vision.",79.99,40,Ella Rivera is an award-winning photographer and photography instructor. She has exhibited her work internationally and has taught photography workshops and seminars around the world. Ella is dedicated to helping students unlock their creative potential and elevate their photography skills to the next level.,,,
10012,Digital Photography Basics,"Digital photography is the art, application, and practice of creating durable images by recording light or other electromagnetic radiation. This course covers the basics of digital photography, including camera settings, composition, lighting, and post-processing techniques. Students will learn how to capture stunning photographs and unleash their creativity.",39.99,20,Samuel Harris is an award-winning photographer with a passion for capturing moments and telling stories through images. He has traveled the world photographing diverse cultures and landscapes and has published his work in leading photography magazines. Samuel enjoys sharing his knowledge and helping aspiring photographers improve their skills.,,,
10013,Graphic Design Fundamentals,"Graphic design is the art and practice of planning and projecting ideas and experiences with visual and textual content. This course covers the fundamentals of graphic design, including typography, color theory, layout design, and image editing. Students will learn how to create visually stunning designs using industry-standard graphic design software.",49.99,25,Sophia Thomas is a talented graphic designer with a passion for creativity and innovation. She holds a Bachelor's degree in Graphic Design from Parsons School of Design and has worked on various design projects for clients in diverse industries. Sophia is committed to helping students develop their design skills and unleash their creative potential.,,,
10014,Digital Marketing Fundamentals,"Digital marketing is the practice of promoting products or services using digital channels such as websites, social media, email, and search engines. This course provides a comprehensive overview of digital marketing fundamentals, including search engine optimization (SEO), social media marketing, email marketing, content marketing, and analytics. Students will learn how to create effective digital marketing strategies and campaigns.",49.99,25,Emily Davis is an experienced digital marketer with a background in marketing and communications. She has worked with various companies to develop and implement successful digital marketing campaigns. Emily is passionate about sharing her knowledge and helping others succeed in the field of digital marketing.,,,
10015,Introduction to Computer Science,"Computer science is the study of computers and computational systems, including their principles, algorithms, programming languages, hardware, and software. This course provides an introduction to computer science concepts, including data structures, algorithms, programming languages, and software development. Students will learn how to solve problems using computational thinking and develop basic programming skills.",49.99,30,Mia White is a computer science educator with a passion for inspiring students to pursue careers in technology. She holds a Master's degree in Computer Science from MIT and has taught computer science courses at both high school and college levels. Mia is dedicated to making computer science accessible and engaging for all students.,,,
10016,Entrepreneurship Essentials,"Entrepreneurship is the process of starting, managing, and growing a business venture. This course covers the essentials of entrepreneurship, including business planning, market research, financing, marketing, and management. Students will learn how to identify opportunities, develop innovative business ideas, and navigate the challenges of entrepreneurship.",69.99,35,Oliver Sanchez is a successful entrepreneur and business consultant. He holds an MBA from Harvard Business School and has launched multiple successful startups in various industries. Oliver is passionate about helping aspiring entrepreneurs turn their ideas into thriving businesses.,,,
10017,Machine Learning Essentials,"Machine learning is a branch of artificial intelligence that enables computers to learn from data and make predictions or decisions without being explicitly programmed. This course covers the essential concepts of machine learning, including supervised and unsupervised learning, regression, classification, clustering, and more. Students will gain hands-on experience with popular machine learning algorithms and tools.",79.99,30,Dr. William Jones is a leading expert in machine learning with a Ph.D. in Computer Science from MIT. He has conducted extensive research in the field and has published numerous papers on topics related to machine learning. Dr. Jones is dedicated to helping students understand and apply machine learning techniques effectively.,,,
10018,Fitness and Nutrition Essentials,"Fitness and nutrition are essential components of a healthy lifestyle. This course provides an overview of fitness and nutrition principles, including exercise physiology, nutrition science, meal planning, and healthy lifestyle habits. Students will learn how to design effective workout programs, make healthy food choices, and achieve their fitness goals.",39.99,30,"Noah Carter is a certified personal trainer and nutrition coach with a passion for helping others live healthier lives. He holds a Bachelor's degree in Exercise Science from the University of California, Berkeley, and has helped clients achieve their fitness and nutrition goals for over a decade. Noah is committed to empowering students to take control of their health and well-being.",,,
10019,Business Management Essentials,"Business management involves coordinating and overseeing the activities of a business to achieve its goals and objectives. This course covers the essential principles and practices of business management, including strategic planning, organizational behavior, human resource management, marketing, and operations management. Students will learn how to effectively manage resources, make strategic decisions, and lead teams.",79.99,40,"Benjamin Jackson is an experienced business manager with a background in business administration. He holds an MBA from Harvard Business School and has led teams in various industries, including finance, technology, and retail. Benjamin is passionate about sharing his knowledge and helping aspiring business leaders succeed.",,,
10020,Digital Music Production,"Digital music production is the process of creating, recording, and editing music using digital technology and software. This course covers the basics of digital music production, including music theory, MIDI sequencing, audio recording, mixing, and mastering. Students will learn how to produce professional-quality music using industry-standard digital audio workstations (DAWs).",59.99,25,"Addison Nelson is a music producer and sound engineer with extensive experience in digital music production. He has worked with artists across various genres and has produced music for commercials, films, and video games. Addison is dedicated to helping students unleash their creativity and produce amazing music.",,,
10021,Project Management Essentials,"Project Management Essentials covers the fundamental concepts and techniques of project management. Topics covered include project planning, scheduling, budgeting, risk management, and team collaboration. Participants will also learn about different project management methodologies.",59.99,30,Daniel Anderson is a certified project manager with a background in software development and IT consulting. He holds a PMP certification and has managed projects for multinational corporations.,,,
10022,Introduction to Cybersecurity,"Introduction to Cybersecurity provides an overview of cybersecurity principles, practices, and technologies. Topics covered include network security, cryptography, threat detection, incident response, and risk management. Participants will gain hands-on experience with cybersecurity tools and techniques.",79.99,45,Ava Taylor is a cybersecurity expert with extensive experience in security analysis and incident response. She holds multiple cybersecurity certifications and has worked for government agencies and private organizations.,,,
10023,Digital Marketing Fundamentals,"Digital Marketing Fundamentals introduces the core concepts and strategies of digital marketing. Topics covered include SEO, SEM, social media marketing, email marketing, and analytics. Participants will learn how to develop and implement effective digital marketing campaigns.",69.99,40,Alexander Moore is a digital marketing strategist with a track record of success in developing and executing digital marketing campaigns. He holds an MBA from Stanford University and has worked for leading marketing agencies.,,,
10024,Introduction to Artificial Intelligence,"Introduction to Artificial Intelligence provides a broad overview of AI concepts and applications. Topics covered include search algorithms, knowledge representation, machine learning, and neural networks. Participants will also explore ethical considerations in AI.",89.99,50,Charlotte Wilson is an AI researcher and educator with expertise in natural language processing and computer vision. She holds a Ph.D. in Artificial Intelligence from MIT and has published research papers in top AI conferences.,,,
10025,Data Visualization with Python,"Data Visualization with Python introduces participants to the principles and techniques of data visualization using Python libraries such as Matplotlib and Seaborn. Topics covered include plotting graphs, creating charts, and visualizing data patterns.",79.99,35,James Miller is a data analyst and visualization expert with a passion for storytelling through data. He holds a Master's degree in Data Science from Columbia University and has presented his work at international conferences.,,,
10026,JavaScript Fundamentals,"JavaScript Fundamentals covers the basics of JavaScript programming, including syntax, data types, control structures, functions, and DOM manipulation. Participants will build interactive web applications and learn how to use JavaScript libraries.",59.99,40,Olivia Davis is a front-end developer with a strong background in JavaScript development. She holds a Bachelor's degree in Computer Science from UCLA and has contributed to open-source JavaScript projects.,,,
10027,Database Design and SQL,"Database Design and SQL provides a comprehensive introduction to database concepts and SQL programming. Participants will learn how to design relational databases, write SQL queries, and perform database administration tasks.",69.99,35,William Jones is a database administrator and SQL expert with over 15 years of experience. He holds multiple certifications in database management and has worked for Fortune 500 companies.,,,
10028,Machine Learning for Beginners,"Machine Learning for Beginners is a beginner-friendly course that introduces the basics of machine learning algorithms and techniques. Participants will learn about supervised and unsupervised learning, regression, classification, clustering, and evaluation metrics.",89.99,45,Emma Brown is a machine learning engineer with a passion for teaching. She holds a Bachelor's degree in Computer Science from UC Berkeley and has worked on projects in areas such as natural language processing and computer vision.,,,
10029,Web Development Fundamentals,"Web Development Fundamentals introduces the core concepts and technologies used in web development. Topics covered include HTML, CSS, JavaScript, and basic web design principles. Participants will build interactive web pages and learn how to deploy websites to the internet.",79.99,50,Michael Williams is a web developer and designer with extensive experience in building responsive and user-friendly websites. He holds a Master's degree in Web Development from Harvard University and has worked on projects for various clients.,,,
10030,Python Programming Basics,"Python Programming Basics is designed for beginners who want to learn programming using Python. The course covers basic syntax, data types, control structures, functions, and file handling in Python. Participants will also work on small coding projects to apply their knowledge.",49.99,30,Emily Johnson is a passionate educator and software developer with expertise in Python programming. She holds a Bachelor's degree in Computer Science from MIT and has authored several Python tutorials and guides.,,,
10031,Data Science Essentials,"Data Science Essentials provides a comprehensive introduction to the fundamental concepts and techniques used in data science. Topics covered include data wrangling, exploratory data analysis, machine learning, and data visualization. The course emphasizes hands-on experience with real-world datasets and practical exercises to reinforce learning.",99.99,40,John Smith is a seasoned data scientist with over 10 years of experience in the industry. He holds a Ph.D. in Computer Science from Stanford University and has published numerous research papers in top-tier conferences and journals.,,,
